{
  "_schemaVersion": 2,
  "delete_redirects": true,
  "delete_logs": false,
  "delete_cache": true,
  "send_feedback": true,
  "uninstall_reason": "performance",
  "selected_issues": "slow-admin,high-database",
  "followup_details": "The admin page got slow after traffic spikes.",
  "feedback_details": "The admin page got slow after traffic spikes.",
  "better_plugin_name": "",
  "other_reason_text": "",
  "feedback_email": "owner@example.com",
  "include_diagnostics": true
}
